"민방위대피시설명",민방위대피시설구분,소재지도로명주소,소재지지번주소,위도,경도,민방위대피시설면적,대피가능인원수,개방여부,평시활용유형,관리기관전화번호,관리기관명,데이터기준일자
"신촌마을 포스홈타운2단지아파트 302~303동 지하주차장",공공용,경기도 용인시 기흥구 신촌로47번길 11,경기도 용인시 기흥구 보정동 1298,37.358983,127.0658714,18844,2030,Y,주차장,031-324-6766,경기도 용인시청,2019-04-05
"보원아파트 102/104/105동 앞 지하주차장",공공용,"경기도 용인시 수지구 수풍로 16(풍덕천동, 토월마을보원아파트)",경기도 용인시 수지구 풍덕천동 692번지,37.30340016,127.0765334,7412,8984,Y,주차장,031-324-8781,경기도 용인시청,2019-04-05
"수지2차삼성아파트 201/202/205동 앞 지하주차장",공공용,"경기도 용인시 수지구 수풍로 38 (풍덕천동, 수지2차삼성래미안)",경기도 용인시 수지구 풍덕천동 692번지 1호,37.307926,127.0761856,8250,10000,Y,주차장,031-324-8781,경기도 용인시청,2019-04-05
"우성그린빌 각 동 지하주차장(후문입구 연결)",공공용,"경기도 용인시 수지구 수지로 398 (풍덕천동, 수지우성그린빌라)",경기도 용인시 수지구 풍덕천동 687번지 1호,37.30999761,127.0791706,10606,480,Y,주차장,031-324-8781,경기도 용인시청,2019-04-05
"한국아파트 101동 앞, 103동 뒤 지하주차장",공공용,"경기도 용인시 수지구 정평로 116 (풍덕천동, 한국아파트)",경기도 용인시 수지구 풍덕천동 699번지,37.30761964,127.0833147,12170,1997,Y,주차장,031-324-8781,경기도 용인시청,2019-04-05
"동보아파트 102동/관리사무소 앞 지하주차장",공공용,"경기도 용인시 수지구 풍덕천로 161 (풍덕천동, 수지마을동보아파트)",경기도 용인시 수지구 풍덕천동 703번지,37.3017107,127.0734575,3907,4736,Y,주차장,031-324-8781,경기도 용인시청,2019-04-05
"수지4차삼성아파트 각 동 지하대피소",공공용,"경기도 용인시 수지구 수풍로 90 (풍덕천동, 수지4차삼성래미안)",경기도 용인시 수지구 풍덕천동 663번지 1호,37.3140878,127.092754,6920,8388,Y,지하시설,031-324-8781,경기도 용인시청,2019-04-05
"동문아파트 관리사무소 앞 지하주차장",공공용,"경기도 용인시 수지구 수풍로 47 (풍덕천동, 동문아파트)",경기도 용인시 수지구 풍덕천동 690번지,37.30478488,127.0907923,2599,3150,Y,주차장,031-324-8781,경기도 용인시청,2019-04-05
"건영아파트 103동 앞 지하주차장",공공용,"경기도 용인시 수지구 수풍로23번길 25 (풍덕천동, 건영아파트)",경기도 용인시 수지구 풍덕천동 694번지,37.3121418,127.0872845,2172,2633,Y,주차장,031-324-8781,경기도 용인시청,2019-04-05
"삼성쉐르빌 각 동 지하주차장",공공용,"경기도 용인시 수지구 수풍로37번길 28 (풍덕천동, 삼성쉐르빌)",경기도 용인시 수지구 풍덕천동 400번지,37.316175,127.0798382,981,1189,Y,주차장,031-324-8781,경기도 용인시청,2019-04-05
"수지구청 지하주차장",공공용,경기도 용인시 수지구 포은대로 435 (풍덕천동),경기도 용인시 수지구 풍덕천동 720번지,37.3141146,127.077801,18010,21830,Y,주차장,031-324-8781,경기도 용인시청,2019-04-05
"동보4차 아파트 지하주차장(전동 지하)",공공용,"경기도 용인시 수지구 풍덕천로30번길 20 (풍덕천동, 두성마을동보4차아파트)",경기도 용인시 수지구 풍덕천동 240번지 3호,37.31862335,127.0718962,5033,6101,Y,주차장,031-324-8781,경기도 용인시청,2019-04-05
"신정마을 7단지 상록아파트 지하주차장(전동 지하)",공공용,"경기도 용인시 수지구 풍덕천로 75 (풍덕천동, 신정마을7단지아파트)",경기도 용인시 수지구 풍덕천동 1060번지,37.3184372,127.0635799,19249,3216,Y,주차장,031-324-8781,경기도 용인시청,2019-04-05
"신정마을 8단지 현대성우아파트 지하주차장(전동 지하)",공공용,"경기도 용인시 수지구 풍덕천로 52 (풍덕천동, 신정마을현대성우아파트)",경기도 용인시 수지구 풍덕천동 1112번지,37.32222237,127.0618088,5151,6244,Y,주차장,031-324-8781,경기도 용인시청,2019-04-05
"신정마을 6단지 상록아파트 지하주차장(전동 지하)",공공용,"경기도 용인시 수지구 풍덕천로 33 (풍덕천동, 신정마을6단지아파트)",경기도 용인시 수지구 풍덕천동 1028번지,37.2332327,127.1963404,4151,5032,Y,주차장,031-324-8781,경기도 용인시청,2019-04-05
"진산마을 삼성7차 아파트 지하주차장(전동 지하)",공공용,"경기도 용인시 수지구 진산로66번길 27 (풍덕천동, 진산마을삼성래미안7차아파트)",경기도 용인시 수지구 풍덕천동 1180번지 1호,37.222691,127.190167,48318,2405,Y,주차장,031-324-8781,경기도 용인시청,2019-04-05
"신정마을 9단지 주공아파트 지하주차장(전동 지하)",공공용,"경기도 용인시 수지구 풍덕천로 76 (풍덕천동, 용인수지신정마을9단지)",경기도 용인시 수지구 풍덕천동 1104번지,37.2582982,127.2368783,12156,3898,Y,주차장,031-324-8781,경기도 용인시청,2019-04-05
"용인시여성회관앞 지하보도",공공용,경기도 용인시 수지구 포은대로 410 (풍덕천동),경기도 용인시 수지구 풍덕천동 1165번지,37.2327418,127.2191418,427,518,Y,지하시설,031-324-8781,경기도 용인시청,2019-04-05
"동보3차 아파트 지하주차장(전동 지하)",공공용,"경기도 용인시 수지구 정평로13번길 20 (풍덕천동, 동보3차아파트)",경기도 용인시 수지구 풍덕천동 504번지 10호,37.2867008,127.1083516,2145,2600,Y,주차장,031-324-8781,경기도 용인시청,2019-04-05
"신정마을 진흥아파트 지하주차장(전동 지하)",공공용,"경기도 용인시 수지구 풍덕천로 19 (풍덕천동, 신정마을진흥아파트)",경기도 용인시 수지구 풍덕천동 1027번지,37.28486973,127.1064474,5151,6244,Y,주차장,031-324-8781,경기도 용인시청,2019-04-05
"신봉동 삼성쉐르빌",공공용,"경기도 용인시 수지구 신봉1로330번길 15-2 (신봉동, 신봉리쉐르빌1단지)",경기도 용인시 수지구 신봉동 708번지 13호,37.2871575,127.1113133,855,1036,Y,주차장,031-324-8652,경기도 용인시청,2019-04-05
"신봉동 LG빌리지5차 A단지",공공용,"경기도 용인시 수지구 신봉1로 112-2 (신봉동, 신봉마을엘지빌리지5차)",경기도 용인시 수지구 신봉동 870번지,37.28822518,127.1141973,27753,2554,Y,주차장,031-324-8652,경기도 용인시청,2019-04-05
"서홍마을 한화꿈에그린",공공용,"경기도 용인시 수지구 신봉1로48번길 32 (신봉동, 서홍마을한화꿈에그린)",경기도 용인시 수지구 신봉동 880번지,37.26755684,127.0962899,10408,1939,Y,주차장,031-324-8652,경기도 용인시청,2019-04-05
"서흥마을 4단지(현대효성)",공공용,"경기도 용인시 수지구 신봉1로 28 (신봉동, 서홍마을효성화운트빌아파트)",경기도 용인시 수지구 신봉동 893번지,37.27148001,127.0736328,8963,10864,Y,주차장,031-324-8652,경기도 용인시청,2019-04-05
"서흥마을 우남퍼스트빌",공공용,"경기도 용인시 수지구 신봉1로 27 (신봉동, 서홍마을우남퍼스트빌)",경기도 용인시 수지구 신봉동 905번지,37.2756222,127.1321516,29165,4618,Y,주차장,031-324-8652,경기도 용인시청,2019-04-05
"신봉마을 엘지자이2차",공공용,"경기도 용인시 수지구 신봉2로 72 (신봉동, 신봉마을자이2차아파트)",경기도 용인시 수지구 신봉동 911번지,37.28355601,127.1123048,31502,7805,Y,주차장,031-324-8652,경기도 용인시청,2019-04-05
"신봉동 엘지빌리지5차 B단지",공공용,"경기도 용인시 수지구 신봉1로 110 (신봉동, 신봉마을엘지빌리지5차)",경기도 용인시 수지구 신봉동 871번지,37.27531699,127.1159548,26752,2669,Y,주차장,031-324-8652,경기도 용인시청,2019-04-05
"신봉마을 엘지자이1차",공공용,"경기도 용인시 수지구 신봉2로 26 (신봉동, 신봉마을엘지자이1차아파트)",경기도 용인시 수지구 신봉동 873번지,37.2633095,127.1059668,34790,9552,Y,주차장,031-324-8652,경기도 용인시청,2019-04-05
"죽전현대1차 아파트(지하주차장)",공공용,"경기도 용인시 수지구 죽전로 244 (죽전동, 현대1차아파트)",경기도 용인시 수지구 죽전동 89번지 1호,37.2625199,127.1103673,6032,7312,Y,주차장,031-324-8665,경기도 용인시청,2019-04-05
"도담마을 죽전파크빌(지하주차장)",공공용,"경기도 용인시 수지구 정든로 22 (죽전동, 도담마을죽전파크빌)",경기도 용인시 수지구 죽전동 339번지,37.26470042,127.1108473,2640,3200,Y,주차장,031-324-8665,경기도 용인시청,2019-04-05
"도담마을7단지 뜨리에체 아파트(지하주차장)",공공용,"경기도 용인시 수지구 푸른솔로 49 (죽전동, 도담마을7단지뜨리에체아파트)",경기도 용인시 수지구 죽전동 414번지,37.24006385,127.0713166,3759,4556,Y,주차장,031-324-8665,경기도 용인시청,2019-04-05
"용인죽전동부센트레빌(지하주차장)",공공용,"경기도 용인시 수지구 대지로 139 (죽전동, 용인죽전동부센트레빌)",경기도 용인시 수지구 죽전동 172번지 1호,37.25168649,127.1175597,9864,11956,Y,주차장,031-324-8665,경기도 용인시청,2019-04-05
"도담마을아이파크(지하주차장)",공공용,"경기도 용인시 수지구 대지로 82 (죽전동, 도담마을아이파크)",경기도 용인시 수지구 죽전동 331번지,37.2312393,127.1095235,8290,10048,Y,주차장,031-324-8665,경기도 용인시청,2019-04-05
"대주한신 아파트 (지하주차장)",공공용,"경기도 용인시 수지구 대지로 27 (죽전동, 대주한신아파트)",경기도 용인시 수지구 죽전동 453번지 1호,37.2283451,127.1144572,7867,9536,Y,주차장,031-324-8665,경기도 용인시청,2019-04-05
"새터마을죽전힐스테이트(715동 지하주차장)",공공용,"경기도 용인시 수지구 현암로125번길 11 (죽전동, 새터마을죽전힐스테이트)",경기도 용인시 수지구 죽전동 1165번지,37.2401063,127.1084713,21029,9590,Y,주차장,031-324-8665,경기도 용인시청,2019-04-05
"성현마을우미이노스빌(지하주차장)",공공용,"경기도 용인시 수지구 죽전로 143 (죽전동, 성현마을우미이노스빌)",경기도 용인시 수지구 죽전동 1329번지,37.24440585,127.0730339,11642,2582,Y,주차장,031-324-8685,경기도 용인시청,2019-04-05
"새터마을죽전힐스테이트(717동 지하주차장)",공공용,"경기도 용인시 수지구 현암로125번길 11 (죽전동, 새터마을죽전힐스테이트)",경기도 용인시 수지구 죽전동 1165번지,37.2380967,127.0722069,40920,9590,Y,주차장,031-324-8685,경기도 용인시청,2019-04-05
"벽산타운2단지내지하주차장",공공용,"경기도 용인시 수지구 용구대로2771번길 66 (죽전동, 용인수지벽산타운2단지)",경기도 용인시 수지구 죽전동 832번지 1호,37.26972996,127.1570934,9864,11956,Y,주차장,031-324-8685,경기도 용인시청,2019-04-05
"죽전아이뷰내지하주차장",공공용,"경기도 용인시 수지구 현암로 3 (죽전동, 죽전아이뷰)",경기도 용인시 수지구 죽전동 883번지 1호,37.28538085,127.1612306,4574,5544,Y,주차장,031-324-8685,경기도 용인시청,2019-04-05
"죽전2동주민센터내주하주차장(포은아트홀내지하주차장)",공공용,"경기도 용인시 수지구 포은대로 523 (죽전동, 죽전2동주민센터)",경기도 용인시 수지구 죽전동 1003번지 239호,37.28173804,127.1578265,15289,18532,Y,주차장,031-324-8685,경기도 용인시청,2019-04-05
"동문굿모닝힐3차 102동 앞 지하주차장",공공용,"경기도 용인시 수지구 동천로 93 (동천동, 동천마을동문굿모닝힐3차아파트)",경기도 용인시 수지구 동천동 858번지,37.26330425,127.153955,7811,9468,Y,주차장,031-324-8705,경기도 용인시청,2019-04-05
"영풍아파트 지하주차장",공공용,"경기도 용인시 수지구 신수로783번길 22 (동천동, 동천마을영풍아파트)",경기도 용인시 수지구 동천동 911번지,37.25999834,127.1627051,2657,3221,Y,주차장,031-324-8705,경기도 용인시청,2019-04-05
"수진마을2단지 지하주차장",공공용,"경기도 용인시 수지구 손곡로 54 (동천동, 수진마을2단지)",경기도 용인시 수지구 동천동 868번지,37.26624531,127.1566532,7712,9348,Y,주차장,031-324-8705,경기도 용인시청,2019-04-05
"동문굿모닝힐6차 604동 앞 지하주차장",공공용,"경기도 용인시 수지구 동천로 53 (동천동, 동문굿모닝힐6차아파트)",경기도 용인시 수지구 동천동 913번지,37.2759176,127.1548917,15645,1056,Y,주차장,031-324-8705,경기도 용인시청,2019-04-05
"수진마을신명스카이뷰 지하주차장",공공용,"경기도 용인시 수지구 손곡로 53 (동천동, 수진마을신명스카이뷰)",경기도 용인시 수지구 동천동 870번지,37.2684339,127.1361769,6768,8204,Y,주차장,031-324-8705,경기도 용인시청,2019-04-05
"수진마을써니벨리 103동 앞 지하주차장",공공용,"경기도 용인시 수지구 손곡로 82 (동천동, 수진마을써니벨리아파트)",경기도 용인시 수지구 동천동 864번지,37.2711718,127.1390783,10105,3010,Y,주차장,031-324-8705,경기도 용인시청,2019-04-05
"래미안이스트팰리스1단지 1101,4동 앞 지하주차장",공공용,"경기도 용인시 수지구 동천로153번길 7 (동천동, 한빛마을래미안이스트팰리스1단지)",경기도 용인시 수지구 동천동 935번지,37.25743575,127.1371108,14346,2208,Y,주차장,031-324-8705,경기도 용인시청,2019-04-05
"래미안이스트팰리스4단지 1401동 앞 지하주차장",공공용,"경기도 용인시 수지구 동천로153번길 6 (동천동, 한빛마을래미안이스트팰리스4단지)",경기도 용인시 수지구 동천동 923번지,37.304093,127.1073251,18963,2976,Y,주차장,031-324-8705,경기도 용인시청,2019-04-05
"고기초등학교 식당",공공용,"경기도 용인시 수지구 고기로 385 (고기동, 고기초등학교)",경기도 용인시 수지구 동천동 172번지 1호,37.3232172,127.1093014,282,342,Y,구내식당,031-324-8705,경기도 용인시청,2019-04-05
"금호베스트빌1단지 지하주차장",공공용,"경기도 용인시 수지구 상현로 59 (상현동, 금호베스트빌1단지아파트)",경기도 용인시 수지구 상현동 827번지,37.311563,127.1123596,19104,2750,Y,주차장,031-324-8732,경기도 용인시청,2019-04-05
"쌍용2차A단지 주차장",공공용,"경기도 용인시 수지구 상현로 27 (상현동, 상현마을쌍용2차스윗닷홈A단지아파트)",경기도 용인시 수지구 상현동 824번지,37.31931014,127.1112253,15348,4738,Y,주차장,031-324-8732,경기도 용인시청,2019-04-05
SM트윈빌 단지내 비상대피시설,공공용,"경기도 용인시 수지구 수지로 56 (상현동, 수지SM트윈빌)",경기도 용인시 수지구 상현동 192번지 5호,37.31744123,127.1132984,380,461,Y,지하시설,031-324-8732,경기도 용인시청,2019-04-05
"풍산아파트",공공용,"경기도 용인시 수지구 수지로78번길 20 (상현동, 풍산아파트)",경기도 용인시 수지구 상현동 96번지 1호,37.31344314,127.1106526,5247,6360,Y,주차장,031-324-8732,경기도 용인시청,2019-04-05
"서원마을3단지아이파크",공공용,"경기도 용인시 수지구 포은대로 219 (상현동, 서원마을3단지아이파크)",경기도 용인시 수지구 상현동 860번지,37.32611746,127.0911925,5792,7021,Y,주차장,031-324-8732,경기도 용인시청,2019-04-05
"수지센트럴아이파크",공공용,"경기도 용인시 수지구 상현로 101 (상현동, 상현마을수지센트럴아이파크)",경기도 용인시 수지구 상현동 842번지,37.32363599,127.0935363,2265,2745,Y,주차장,031-324-8732,경기도 용인시청,2019-04-05
"현대아파트",공공용,"경기도 용인시 수지구 상현로 2 (상현동, 상현마을현대2차아이파크)",경기도 용인시 수지구 상현동 853번지,37.32902603,127.0911419,10446,2390,Y,주차장,031-324-8732,경기도 용인시청,2019-04-05
"동보2차아파트 102동 지하주차장",공공용,"경기도 용인시 수지구 포은대로 298 (상현동, 만현마을동보2차아파트)",경기도 용인시 수지구 상현동 1번지,37.3164253,127.0872684,8583,10404,Y,주차장,031-324-8584,경기도 용인시청,2019-04-05
"성원아파트 113동 지하주차장외",공공용,"경기도 용인시 수지구 진산로 24 (상현동, 성원상떼빌아파트)",경기도 용인시 수지구 상현동 30번지,37.31891994,127.0864771,20760,8371,Y,주차장,031-324-8584,경기도 용인시청,2019-04-05
"엘지자이아파트 901동 지하주차장",공공용,"경기도 용인시 수지구 만현로133번길 33 (상현동, 만현마을9단지엘지자이아파트)",경기도 용인시 수지구 상현동 869번지,37.31720775,127.086791,10368,4963,Y,주차장,031-324-8584,경기도 용인시청,2019-04-05
"상현그린공원(상현2동주민센터) 지하주차장",공공용,"경기도 용인시 수지구 만현로 48 (상현동, 상현2동주민자치센터)",경기도 용인시 수지구 상현동 57번지 1호,37.3373824,127.0931922,6811,8256,Y,주차장,031-324-8584,경기도 용인시청,2019-04-05
"성복동 성동마을 LG빌리지1차 지하주차장",공공용,"경기도 용인시 수지구 성복2로 86 (성복동, 성동마을엘지빌리지1차)",경기도 용인시 수지구 성복동 155번지,37.30544925,127.0790711,73055,5587,Y,주차장,031-324-8765,경기도 용인시청,2019-04-05
"성복동 푸른마을 푸르지오 지하주차장",공공용,"경기도 용인시 수지구 성복2로76번길 31 (성복동, 푸른마을푸르지오)",경기도 용인시 수지구 성복동 741번지,37.30792465,127.0800303,22229,2064,Y,주차장,031-324-8765,경기도 용인시청,2019-04-05
"성복동 성동마을 강남빌리지 지하주차장",공공용,"경기도 용인시 수지구 수지로113번길 16 (성복동, 성동마을강남빌리지)",경기도 용인시 수지구 성복동 84번지,37.3133352,127.0874438,16084,2054,Y,주차장,031-324-8765,경기도 용인시청,2019-04-05
"성복동 성동마을 LG빌리지 3차 지하주차장",공공용,"경기도 용인시 수지구 성복2로 126 (성복동, 성동마을엘지빌리지3차)",경기도 용인시 수지구 성복동 726번지,37.3169439,127.075941,70478,5923,Y,주차장,031-324-8765,경기도 용인시청,2019-04-05
"성복동 벽산아파트 제5주차장",공공용,"경기도 용인시 수지구 성복1로 107 (성복동, 성남마을벽산첼시빌2차아파트)",경기도 용인시 수지구 성복동 723번지,37.3144979,127.0663465,6425,7788,Y,주차장,031-324-8765,경기도 용인시청,2019-04-05
"성복동 힐스테이트 2차 지하주차장",공공용,"경기도 용인시 수지구 성복1로164번길 13 (성복동, 버들치마을성복힐스테이트2차아파트)",경기도 용인시 수지구 성복동 759번지,37.31932085,127.0853042,37934,3307,Y,주차장,031-324-8765,경기도 용인시청,2019-04-05
"성복동 성복아이파크 지하1,2층",공공용,"경기도 용인시 수지구 성복1로 222 (성복동, 용인성복아이파크)",경기도 용인시 수지구 성복동 780번지,37.25271891,127.1195362,7904,9581,Y,주차장,031-324-8765,경기도 용인시청,2019-04-05
