"민방위대피시설명",민방위대피시설구분,소재지도로명주소,소재지지번주소,위도,경도,민방위대피시설면적,대피가능인원수,개방여부,평시활용유형,관리기관전화번호,관리기관명,데이터기준일자
"선비마을 삼정아파트 지하주차장(101동 앞)",공공용,경기도 용인시 기흥구 사은로 64,경기도 용인시 기흥구 보라동 289-12,37.2460487,127.0724171,3024,3665,Y,주차장,031-324-6625,경기도 용인시청,2019-04-05
"넥스빌아파트 지하주차장",공공용,경기도 용인시 기흥구 금화로108번길 21,경기도 용인시 기흥구 상갈동 102-3,37.235632,127.0701048,2328,2822,Y,주차장,031-324-6653,경기도 용인시청,2019-04-05
"금화마을 주공2단지 지하주차장(201과 202동 사이)",공공용,경기도 용인시 기흥구 금화로11번길 15,경기도 용인시 기흥구 상갈동 479,37.23557784,127.0752071,2016,2444,Y,주차장,031-324-6653,경기도 용인시청,2019-04-05
"금화마을 주공3단지 지하주차장(307동 앞)",공공용,경기도 용인시 기흥구 금화로11번길 10,경기도 용인시 기흥구 상갈동 481,37.2967623,127.1189833,21519,5136,Y,주차장,031-324-6653,경기도 용인시청,2019-04-05
"금화마을 주공4단지 지하주차장(407동 앞)",공공용,경기도 용인시 기흥구 금화로58번길 10,경기도 용인시 기흥구 상갈동 463,37.29337141,127.1219282,14783,3562,Y,주차장,031-324-6653,경기도 용인시청,2019-04-05
"금화마을 주공5단지 지하주차장(502동 앞)",공공용,경기도 용인시 기흥구 금화로82번길 17,경기도 용인시 기흥구 상갈동 454,37.2954196,127.1492204,14860,3269,Y,주차장,031-324-6653,경기도 용인시청,2019-04-05
"금화마을 주공6단지 지하주차장(602동 앞)",공공용,경기도 용인시 기흥구 금화로11번길 9,경기도 용인시 기흥구 상갈동 480,37.29397102,127.1275096,4782,5796,Y,주차장,031-324-6653,경기도 용인시청,2019-04-05
"민속마을 신창미션힐 지하주차장(201동 204동 사이)",공공용,경기도 용인시 기흥구 사은로126번길 33,경기도 용인시 기흥구 보라동 558,37.29523478,127.1472622,35085,4445,Y,주차장,031-324-6653,경기도 용인시청,2019-04-05
"현대모닝사이드1차 지하주차장(305와 307동 사이)",공공용,경기도 용인시 기흥구 사은로126번길 46,경기도 용인시 기흥구 보라동 570,37.29644012,127.1130729,32107,5338,Y,주차장,031-324-6653,경기도 용인시청,2019-04-05
"현대모닝사이드2차 지하주차장(101동 앞)",공공용,경기도 용인시 기흥구 용구대로 1842,경기도 용인시 기흥구 보라동 564,37.3059191,127.1267138,25249,3701,Y,주차장,031-324-6653,경기도 용인시청,2019-04-05
"민속마을 쌍용아파트 지하주차장(104와 105동 사이)",공공용,경기도 용인시 기흥구 사은로126번길 10,경기도 용인시 기흥구 보라동 553,37.3012583,127.1145336,56650,7661,Y,주차장,031-324-6653,경기도 용인시청,2019-04-05
"자봉마을 써니밸리 지하주차장(103과 106동 사이)",공공용,경기도 용인시 기흥구 사은로 274-22,경기도 용인시 기흥구 지곡동 704,37.2990376,127.1115909,32863,5242,Y,주차장,031-324-6853,경기도 용인시청,2019-04-05
"동성아파트 지하주차장",공공용,경기도 용인시 기흥구 고매로 28,경기도 용인시 기흥구 고매동 359,37.30044233,127.111378,2036,2468,Y,주차장,031-324-6853,경기도 용인시청,2019-04-05
"세원아파트 지하주차장",공공용,경기도 용인시 기흥구 공세로 76,경기도 용인시 기흥구 고매동 385-1,37.3003471,127.1245561,5154,6247,Y,주차장,031-324-6853,경기도 용인시청,2019-04-05
"호수 청구아파트 지하주차장",공공용,경기도 용인시 기흥구 공세로 226,경기도 용인시 기흥구 공세동 382-1,37.30293693,127.1182621,6469,7841,Y,주차장,031-324-6853,경기도 용인시청,2019-04-05
"매화마을 우림홀인원아파트 지하주차장",공공용,경기도 용인시 기흥구 고매로34번길 31,경기도 용인시 기흥구 고매동 880,37.307010,127.1282625,1570,1903,Y,주차장,031-324-6853,경기도 용인시청,2019-04-05
"불곡마을 벽산블루밍아파트 지하주차장",공공용,경기도 용인시 기흥구 고매로43번길 32-2,경기도 용인시 기흥구 공세동  663,37.2985393,127.1052939,2645,3206,Y,주차장,031-324-6853,경기도 용인시청,2019-04-05
"탑실마을 대주피오레1단지 아파트 지하주차장",공공용,경기도 용인시 기흥구 탑실로 15,경기도 용인시 기흥구 공세동 694,37.28285713,127.1644413,42759,3408,Y,주차장,031-324-6853,경기도 용인시청,2019-04-05
"기흥써니밸리아파트",공공용,"경기도 용인시 기흥구 고매로 16 (고매동, 기흥써니밸리아파트)",경기도 용인시 기흥구 고매동 883번지,37.28224495,127.1640656,4011,4862,Y,주차장,031-324-6853,경기도 용인시청,2019-04-05
"경희대학교 국제캠퍼스(우정원 지하)",공공용,경기도 용인시 기흥구 덕영대로1732,경기도 용인시 기흥구 서천동 1,37.28175624,127.1549623,22935,27800,Y,대학교,031-324-6691,경기도 용인시청,2019-04-05
"서그내마을 에스케이아파트(전동 지하)",공공용,"경기도 용인시 기흥구 예현로15(서천동, 서그내마을 에스케이아파트)",경기도 용인시 기흥구 서천동 700,37.2795982,127.1490963,14161,3874,Y,주차장,031-324-6691,경기도 용인시청,2019-04-05
"예현마을 현대홈타운아파트(전동 지하)",공공용,"경기도 용인시 기흥구 예현로35번길21(서천동,예현마을 현대홈타운아파트)",경기도 용인시 기흥구 서천동 705,37.27977852,127.1514312,15193,2986,Y,주차장,031-324-6691,경기도 용인시청,2019-04-05
"서그내마을 서천아이파크(전동 지하)",공공용,"경기도 용인시 기흥구 서그내로16번길14(서천동,서그내마을 서천아이파크)",경기도 용인시 기흥구 서천동 708,37.27939811,127.1557333,16337,1166,Y,주차장,031-324-6691,경기도 용인시청,2019-04-05
"서천마을 휴먼시아2단지아파트(전동 지하)",공공용,"경기도 용인시 기흥구 서천로128번길12(서천동,서천마을 휴먼시아2단지아파트)",경기도 용인시 기흥구 서천동 743,37.2798532,127.1576534,7242,8778,Y,주차장,031-324-6691,경기도 용인시청,2019-04-05
"서천마을 휴먼시아3단지아파트(전동 지하)",공공용,"경기도 용인시 기흥구 서천서로125(농서동, 서천마을 휴먼시아3단지아파트)",경기도 용인시 기흥구 농서동 310-5,37.27151256,127.1554645,10814,4704,Y,주차장,031-324-6691,경기도 용인시청,2019-04-05
"서천마을 1단지아파트(전동 지하)",공공용,"경기도 용인시 기흥구 서천서로27(서천동, 서천마을1단지)",경기도 용인시 기흥구 서천동 736,37.26253235,127.1598562,20045,3965,Y,주차장,031-324-6691,경기도 용인시청,2019-04-05
"서천마을4단지 아파트(전동 지하)",공공용,"경기도 용인시 기흥구 서천동로60(서천동,서천마을4단지아파트)",경기도 용인시 기흥구 서천동 823,37.28609283,127.1515656,17955,2669,Y,주차장,031-324-6691,경기도 용인시청,2019-04-05
"구성동주민센터 지하",공공용,경기도 용인시 기흥구 구성로 77번길 17,경기도 용인시 기흥구 언남동 342-1,37.28618307,127.1542497,787,954,Y,주차장,031-324-6876,경기도 용인시청,2019-04-05
"언남동부아파트 101동 지하주차장",공공용,경기도 용인시 기흥구 구성로 123,경기도 용인시 기흥구 언남동 240-1,37.28421823,127.1601095,1646,1995,Y,주차장,031-324-6876,경기도 용인시청,2019-04-05
"휴먼시아물푸레마을2단지 203동 지하주차장",공공용,경기도 용인시 기흥구 구성3로 37,경기도 용인시 기흥구 청덕동506,37.28345061,127.1573745,12000,1867,Y,주차장,031-324-6876,경기도 용인시청,2019-04-05
"동일하이빌2차아파트 212동 지하주차장",공공용,경기도 용인시 기흥구 언남로 15,경기도 용인시 기흥구 언남동 496,37.28028517,127.1607958,54721,4018,Y,주차장,031-324-6876,경기도 용인시청,2019-04-05
"초원마을 성원상떼빌아파트 입구 지하주차장",공공용,경기도 용인시 기흥구 기흥로116번길,경기도 용인시 기흥구 언남동 500,37.27930768,127.1446241,35874,4128,Y,주차장,031-324-6876,경기도 용인시청,2019-04-05
"휴먼시아물푸레마을1단지아파트 101동 지하주차장",공공용,경기도 용인시 기흥구 구성2로 52,경기도 용인시 기흥구 청덕동 513,37.2746031,127.1560871,21000,2966,Y,주차장,031-324-6876,경기도 용인시청,2019-04-05
"우림필유아파트 103동 앞 지하주차장",공공용,경기도 용인시 기흥구 구성로39번길 13,경기도 용인시 기흥구 마북동 352,37.27730552,127.1573752,7259,8799,Y,주차장,031-324-6721,경기도 용인시청,2019-04-05
"교동마을 신창아파트 101동 앞 지하주차장",공공용,경기도 용인시 기흥구 마북로 186,경기도 용인시 기흥구 마북동 143,37.2709056,127.1581929,6396,7753,Y,주차장,031-324-6721,경기도 용인시청,2019-04-05
"연원마을 삼성쉐르빌아파트 201동 앞 지하주차장",공공용,경기도 용인시 기흥구 연원로42번길 33,경기도 용인시 기흥구 마북동 642-1,37.26330491,127.1589108,18129,422,Y,주차장,031-324-6721,경기도 용인시청,2019-04-05
"삼성래미안1차아파트 110동 앞 지하주차장",공공용,경기도 용인시 기흥구 용구대로2394번길 27,경기도 용인시 기흥구 마북동 629,37.2642454,127.1574124,11571,422,Y,주차장,031-324-6721,경기도 용인시청,2019-04-05
"연원마을 벽산아파트 117동 앞 지하주차장",공공용,경기도 용인시 기흥구 연원로42번길 2,경기도 용인시 기흥구 마북동 524-8,37.28336241,127.1665218,10527,389,Y,주차장,031-324-6721,경기도 용인시청,2019-04-05
"교동마을 현대홈타운아파트 103동 앞 지하주차장",공공용,경기도 용인시 기흥구 마북로 124-9,경기도 용인시 기흥구 마북동 630,37.2810521,127.1613477,7699,9332,Y,주차장,031-324-6721,경기도 용인시청,2019-04-05
"교동마을 구성자이3차아파트 104동 앞 지하주차장",공공용,경기도 용인시 구교동로118번길 7,경기도 용인시 기흥구 마북동 638,37.2733328,127.1594197,10800,298,Y,주차장,031-324-6721,경기도 용인시청,2019-04-05
"교동마을 마북 이-편한세상아파트 105동 앞 지하주차장",공공용,경기도 용인시 기흥구 마북로 210,경기도 용인시 기흥구 마북동 636,37.2771018,127.1447372,1473,1785,Y,주차장,031-324-6721,경기도 용인시청,2019-04-05
"구성역 지하역사",공공용,경기도 용인시 기흥구 용구대로 2403,경기도 용인시 기흥구 마북동 460-3,37.2804911,127.1465298,11353,13761,Y,지하철역사,031-324-6721,경기도 용인시청,2019-04-05
"백현마을 휴먼시아아파트 모든 지하주차장",공공용,"경기도 용인시 기흥구 동백8로131번길 9 (동백동,백현마을휴먼시아)",경기도 용인시 기흥구 동백동  583,37.26250213,127.1410973,7484,9072,Y,주차장,031-324-6747,경기도 용인시청,2019-04-05
"백현마을 모아미래도아파트(2500단지) 모든 지하주차장",공공용,"경기도 용인시 기흥구 동백8로 126(동백동,백현마을모아미래도2단지아파트)",경기도 용인시 기흥구 동백동  593,37.25603786,127.1427625,66486,1613,Y,주차장,031-324-6747,경기도 용인시청,2019-04-05
"호수마을 동보노빌리티 모든 지하주차장",공공용,"경기도 용인시 기흥구 동백평촌로 39(동백동,호수마을동보노빌리티)",경기도 용인시 기흥구 동백동 654,37.2593378,127.1385907,21298,2309,Y,주차장,031-324-6747,경기도 용인시청,2019-04-05
"동원마을 동원로얄듀크 모든 지하주차장",공공용,"경기도 용인시 기흥구 동백죽전대로 455-17(동백동, 동원마을동백로얄듀크)",경기도 용인시 기흥구 동백동 683,37.30326149,127.1106151,2172,2633,Y,주차장,031-324-6747,경기도 용인시청,2019-04-05
"해든마을 동문굿모닝힐아파트 모든 지하주차장",공공용,"경기도 용인시 기흥구 동백죽전대로 455-10(동백동,해든마을동문굿모닝힐)",경기도 용인시 기흥구 동백동 689,37.3049729,127.1073059,2566,3110,Y,주차장,031-324-6747,경기도 용인시청,2019-04-05
"호수마을 상록롯데캐슬아파트 모든 지하주차장",공공용,"경기도 용인시 기흥구 동백평촌로 70(동백동,호수마을상록롯데캐슬)",경기도 용인시 기흥구 중동  828,37.3079519,127.1063048,12563,2650,Y,주차장,031-324-6747,경기도 용인시청,2019-04-05
"백현마을 동일하이빌아파트 모든 지하주차장",공공용,"경기도 용인시 기흥구 동백중앙로 312 (중동, 백현마을 동일하이빌 아파트)",경기도 용인시 기흥구 중동  874,37.320049,127.1108698,25148,3566,Y,주차장,031-324-6747,경기도 용인시청,2019-04-05
"성산마을 서해그랑블아파트 모든 지하주차장",공공용,"경기도 용인시 기흥구 동백4로 26 (중동, 성산마을 서해그랑블)",경기도 용인시 기흥구 중동  860,37.30910758,127.0981522,5179,6278,Y,주차장,031-324-6747,경기도 용인시청,2019-04-05
"어은목마을 대원칸타빌아파트 모든 지하주차장",공공용,"경기도 용인시 기흥구 동백2로 37 (중동, 어은목마을대원칸타빌)",경기도 용인시 기흥구 중동 958,37.31756472,127.1160377,3296,3995,Y,주차장,031-324-6747,경기도 용인시청,2019-04-05
"초당마을 현진에버빌아파트 모든 지하주차장",공공용,"경기도 용인시 기흥구 동백중앙로 73(중동, 초당마을현진에버빌)",경기도 용인시 기흥구 중동 1045,37.3062304,127.0982969,10729,1536,Y,주차장,031-324-6747,경기도 용인시청,2019-04-05
"호수마을 자연&데시앙아파트 모든 지하주차장",공공용,"경기도 용인시 기흥구 동백8로 9 (동백동, 호수마을자연앤데시앙)",경기도 용인시 기흥구 동백동 572,37.3106907,127.1101937,9760,11830,Y,주차장,031-324-6747,경기도 용인시청,2019-04-05
"백현마을 서해그랑블아파트 모든 지하주차장",공공용,"경기도 용인시 기흥구 동백8로 89 (동백동,백현마을서해그랑블아파트)",경기도 용인시 기흥구 동백동 579,37.308879,127.1092833,12607,2314,Y,주차장,031-324-6747,경기도 용인시청,2019-04-05
"호수마을 휴먼시아아파트 모든 지하주차장",공공용,"경기도 용인시 기흥구 동백8로 27 (동백동, 호수마을어울림아파트)",경기도 용인시 기흥구 동백동 575,37.3272638,127.0915124,7543,9143,Y,주차장,031-324-6747,경기도 용인시청,2019-04-05
"백현마을 모아미래도아파트(2400단지) 모든 지하주차장",공공용,"경기도 용인시 기흥구 동백8로 90 (동백동, 백현마을모아미래도1단지 아파트)",경기도 용인시 기흥구 동백동 599,37.3314239,127.098674,15832,4022,Y,주차장,031-324-6747,경기도 용인시청,2019-04-05
"호수마을 주공아파트 모든 지하주차장",공공용,"경기도 용인시 기흥구 동백8로 64 (동백동, 호수마을주공3단지아파트)",경기도 용인시 기흥구 동백동 602,37.3262882,127.098504,11262,4310,Y,주차장,031-324-6747,경기도 용인시청,2019-04-05
"호수마을 서해그랑블아파트 모든 지하주차장",공공용,"경기도 용인시 기흥구 동백7로 56 (동백동, 호수마을 서해그랑블)",경기도 용인시 기흥구 동백동 656,37.33041897,127.0935176,12345,2573,Y,주차장,031-324-6747,경기도 용인시청,2019-04-05
"백현마을 한라비발디아파트(2300단지) 모든 지하주차장",공공용,"경기도 용인시 기흥구 동백7로 96 (동백동, 백현마을한라비발디)",경기도 용인시 기흥구 동백동 662,37.32701491,127.086360,9684,11738,Y,주차장,031-324-6747,경기도 용인시청,2019-04-05
"어정마을 삼정그린뷰아파트 모든 지하주차장",공공용,"경기도 용인시 기흥구 언동로 193-26(중동, 어정마을서희삼정아파트)",경기도 용인시 기흥구 중동  817,37.329211,127.0888079,13806,1872,Y,주차장,031-324-6747,경기도 용인시청,2019-04-05
"참솔마을 월드메르디앙아파트 모든 지하주차장",공공용,"경기도 용인시 기흥구 동백죽전대로 283(중동, 참솔마을월드메르디앙)",경기도 용인시 기흥구 중동  819,37.3217914,127.097733,9352,11336,Y,주차장,031-324-6747,경기도 용인시청,2019-04-05
"성산마을 하우스토리 모든 지하주차장",공공용,"경기도 용인시 기흥구 동백5로 62 (중동,성산마을 남광하우스토리)",경기도 용인시 기흥구 중동  869,37.32050276,127.0904907,10608,643,Y,주차장,031-324-6747,경기도 용인시청,2019-04-05
"백현마을 상록롯데캐슬아파트 모든 지하주차장",공공용,"경기도 용인시 기흥구 동백5로 79(중동,백현마을롯데캐슬아파트)",경기도 용인시 기흥구 중동  878,37.31757596,127.0908121,8102,9821,Y,주차장,031-324-6747,경기도 용인시청,2019-04-05
"어은목마을 한라비발디아파트 모든 지하주차장",공공용,"경기도 용인시 기흥구 동백4로 72 (중동, 어은목마을한라비발디)",경기도 용인시 기흥구 중동  956,37.3148475,127.0979412,7533,9131,Y,주차장,031-324-6747,경기도 용인시청,2019-04-05
"초당마을 주공아파트 모든 지하주차장",공공용,"경기도 용인시 기흥구 동백중앙로 41 (중동, 초당마을주공아파트)",경기도 용인시 기흥구 중동  1041,37.3196623,127.0919751,9387,11378,Y,주차장,031-324-6747,경기도 용인시청,2019-04-05
"초당마을 코아루아파트(5000단지) 모든 지하주차장",공공용,"경기도 용인시 기흥구 동백1로 12 (중동, 초당마을코아루아파트)",경기도 용인시 기흥구 중동  1046,37.3194914,127.0962611,6877,8336,Y,주차장,031-324-6747,경기도 용인시청,2019-04-05
"초당마을 코아루아파트(5100단지) 모든 지하주차장",공공용,"경기도 용인시 기흥구 동백1로 9 (중동,초당마을코아루아파트)",경기도 용인시 기흥구 중동  1047,37.2353409,127.201615,6671,8086,Y,주차장,031-324-6747,경기도 용인시청,2019-04-05
"어은목마을 코아루아파트 모든 지하주차장",공공용,"경기도 용인시 기흥구 동백2로 12 (중동, 어은목마을코아루아파트)",경기도 용인시 기흥구 중동  1050,37.3343141,127.0547323,21812,2842,Y,주차장,031-324-6747,경기도 용인시청,2019-04-05
"백현마을 주공아파트 모든 지하주차장",공공용,"경기도 용인시 기흥구 동백8로131번길 20 (동백동, 백현마을주공9단지아파트)",경기도 용인시 기흥구 동백동 584,37.32592098,127.0730946,12254,4709,Y,주차장,031-324-6747,경기도 용인시청,2019-04-05
"백현마을 한라비발디아파트(2300단지) 모든 지하주차장",공공용,"경기도 용인시 기흥구 동백7로 97 (동백동, 백현마을한라비발디아파트)",경기도 용인시 기흥구 동백동 596,37.32348246,127.0818565,9684,11738,Y,주차장,031-324-6747,경기도 용인시청,2019-04-05
"성산마을 카운티스 모든 지하주차장",공공용,"경기도 용인시 기흥구 동백2로 108 (중동, 성산마을카운티스)",경기도 용인시 기흥구 중동  922,37.3209663,127.0819607,5428,6579,Y,주차장,031-324-6747,경기도 용인시청,2019-04-05
"성산마을 신영지웰아파트 모든 지하주차장",공공용,"경기도 용인시 기흥구 동백5로 41 (중동, 성산마을신영지웰)",경기도 용인시 기흥구 중동 870,37.31920082,127.0817571,8469,10265,Y,주차장,031-324-6747,경기도 용인시청,2019-04-05
"어정마을 동백아이파크아파트 모든 지하주차장",공공용,"경기도 용인시 기흥구 언동로217번길 11 (중동, 어정마을동백아이파크)",경기도 용인시 기흥구 중동  1081,37.3291472,127.074433,6079,7368,Y,주차장,031-324-6747,경기도 용인시청,2019-04-05
"신동백 서해그랑블(100단지) 모든 지하주차장",공공용,"경기도 용인시 기흥구 동백죽전대로527번길 81 (중동, 신동백서해그랑블1차)",경기도 용인시 기흥구 중동 1102,37.32728271,127.0741114,7569,9175,Y,주차장,031-324-6747,경기도 용인시청,2019-04-05
"지석마을 그대가 크레던스 아파트 모든 지하주차장",공공용,경기도 용인시 기흥구 어정로 62-28,경기도 용인시 기흥구 상하동 675,37.3260322,127.0782523,16884,2659,Y,주차장,031-324-6782,경기도 용인시청,2019-04-05
"대우아파트 모든 지하주차장",공공용,경기도 용인시 기흥구 중부대로 735,경기도 용인시 기흥구 상하동 296,37.33243086,127.130725,5530,6703,Y,주차장,031-324-6782,경기도 용인시청,2019-04-05
"신일유토빌 아파트 모든 지하주차장",공공용,경기도 용인시 기흥구 어정로 62-7,경기도 용인시 기흥구 상하동 656,37.32768531,127.1158457,8552,10366,Y,주차장,031-324-6782,경기도 용인시청,2019-04-05
"인정프린스 아파트 모든 지하주차장",공공용,경기도 용인시 중부대로 820,경기도 용인시 기흥구 상하동 137,37.3249256,127.1147673,1779,2156,Y,주차장,031-324-6782,경기도 용인시청,2019-04-05
"쌍용아파트 모든 지하주차장",공공용,경기도 용인시 중부대로 788번길 20,경기도 용인시 기흥구 상하동 621,37.33082163,127.1257258,68043,6442,Y,주차장,031-324-6782,경기도 용인시청,2019-04-05
"진흥더루벤스 아파트 모든 지하주차장",공공용,경기도 용인시 중부대로 746번길 21,경기도 용인시 기흥구 상하동 660,37.32924797,127.1174007,56717,4085,Y,주차장,031-324-6782,경기도 용인시청,2019-04-05
"연원마을 성원아파트 103동 앞 지하주차장",공공용,경기도 용인시 기흥구 연원로 49,경기도 용인시 기흥구 보정동 694,37.32812416,127.113003,28760,3317,Y,주차장,031-324-6766,경기도 용인시청,2019-04-05
"연원마을 금호베스트빌 101동 지하주차장",공공용,경기도 용인시 기흥구 용구대로 2442-2,경기도 용인시 기흥구 보정동 1172,37.3344908,127.1212644,3867,4687,Y,주차장,031-324-6766,경기도 용인시청,2019-04-05
"연원마을 삼성명가타운아파트 전동 지하주차장",공공용,경기도 용인시 기흥구 용구대로 2460,경기도 용인시 기흥구 보정동 1177,37.32489829,127.1239694,11290,2035,Y,주차장,031-324-6766,경기도 용인시청,2019-04-05
"죽전 신세계쉐덴 전동 지하주차장",공공용,경기도 용인시 기흥구 진산로 222,경기도 용인시 기흥구 보정동 1179,37.3344908,127.1212644,3122,3784,Y,주차장,031-324-6766,경기도 용인시청,2019-04-05
"죽전자이2차아파트 지하주차장",공공용,경기도 용인시 기흥구 용구대로2469번길 20,경기도 용인시 기흥구 보정동 1291,37.3355358,127.1057095,6807,8251,Y,주차장,031-324-6766,경기도 용인시청,2019-04-05
"죽전누리에뜰아파트 지하주차장",공공용,경기도 용인시 기흥구 죽전로 20,경기도 용인시 기흥구 보정동 1263,37.33253465,127.1102022,6530,7915,Y,주차장,031-324-6766,경기도 용인시청,2019-04-05
"행원마을 동아솔레시티아파트 120동 지하주차장",공공용,경기도 용인시 기흥구 보정로 30,경기도 용인시 기흥구  보정동 1162,37.3260259,127.1069224,126849,8165,Y,주차장,031-324-6766,경기도 용인시청,2019-04-05
"솔뫼마을 현대홈타운 전동 지하주차장",공공용,경기도 용인시 기흥구 이현로30번길 7,경기도 용인시 기흥구 보정동 1169,37.3383055,127.0937324,60387,1834,Y,주차장,031-324-6766,경기도 용인시청,2019-04-05
"죽현마을 동원로얄듀크 310동 지하주차장",공공용,경기도 용인시 기흥구 죽현로 12,경기도 용인시 기흥구 보정동 1271,37.3405706,127.1005409,21806,3389,Y,주차장,031-324-6766,경기도 용인시청,2019-04-05
"죽현마을 엘지자이 102동 지하주차장",공공용,경기도 용인시 기흥구 보정로 88,경기도 용인시 기흥구 보정동 1258,37.33744416,127.0970651,3947,4784,Y,주차장,031-324-6766,경기도 용인시청,2019-04-05
"죽현마을 아이파크아파트 205동 지하주차장",공공용,경기도 용인시 기흥구 보정로 87,경기도 용인시 기흥구 보정동 1267,37.3398297,127.0972126,5272,6390,Y,주차장,031-324-6766,경기도 용인시청,2019-04-05
"성호샤인힐즈아파트 101동 지하주차장",공공용,경기도 용인시 기흥구 이현로29번길 72-1,경기도 용인시 기흥구 보정동  878-22,37.33593833,127.0962146,1915,2321,Y,주차장,031-324-6766,경기도 용인시청,2019-04-05
"신촌마을 상록데시앙 101동 지하주차장",공공용,경기도 용인시 기흥구 보정로 26,경기도 용인시 기흥구 보정동 1283,37.3363875,127.0880283,5360,6497,Y,주차장,031-324-6766,경기도 용인시청,2019-04-05
"신촌마을 포스홈타운1단지아파트 206동 지하주차장",공공용,경기도 용인시 기흥구 용구대로2518번길 15,경기도 용인시 기흥구 보정동 1282,37.3356019,127.0850101,30469,4243,Y,주차장,031-324-6766,경기도 용인시청,2019-04-05
