"민방위대피시설명",민방위대피시설구분,소재지도로명주소,소재지지번주소,위도,경도,민방위대피시설면적,대피가능인원수,개방여부,평시활용유형,관리기관전화번호,관리기관명,데이터기준일자
"장수군청",공공용,전라북도 장수군 장수읍 호비로 10,전라북도 장수군 장수읍 장수리 176-7,35.64782362,127.5208204,3165,3836,Y,지하시설,063-350-2482,전라북도 장수군청,2020-09-16
"보건의료원",공공용,전라북도 장수군 장수읍 장천로 247,전라북도 장수군 장수읍 장수리 425,35.65458554,127.5194376,390,473,Y,지하주차장,063-350-3192,전라북도 장수군청,2020-09-16
"노인복지회관",공공용,전라북도 장수군 장수읍 노하3길 16,전라북도 장수군 장수읍 노하리 378-3,35.6535137755,127.5172943454,257,312,Y,지하주차장,063-353-8289,전라북도 장수군청,2020-09-16
"장수우체국",공공용,전라북도 장수군 장수읍 싸리재로 5,전라북도 장수군 장수읍 장수리 454-16,35.649471,127.519634,539,653,Y,지하시설,063-351-5503,전라북도 장수군청,2020-09-16
"장수경찰서",공공용,전라북도 장수군 장수읍 신천로 8,전라북도 장수군 장수읍 장수리 546,35.6472878,127.5163207,528,640,Y,지하시설,063-350-4239,전라북도 장수군청,2020-09-16
"장수 타코마",공공용,전라북도 장수군 계남면 장수로 2662-11,전라북도 장수군 계남면 신전리 1454-45,35.6760364,127.5510388,3123,3785,Y,지하주차장,063-353-8200,전라북도 장수군청,2020-09-16
