"민방위대피시설명",민방위대피시설구분,소재지도로명주소,소재지지번주소,위도,경도,민방위대피시설면적,대피가능인원수,개방여부,평시활용유형,관리기관전화번호,관리기관명,데이터기준일자
"무주군청 지하주차장(지하1층)",공공용,전라북도 무주군 무주읍 주계로 97,전라북도 무주군 무주읍 읍내리 229-2,36.007219799,127.660842754,2116,2565,Y,지하주차장,063-320-2222,전라북도 무주군청,2021-07-09
"무주군청 구내식당(지하1층)",공공용,전라북도 무주군 무주읍 주계로 97,전라북도 무주군 무주읍 읍내리 229-2,36.007598291,127.660845913,337,408,Y,구내식당,063-320-2222,전라북도 무주군청,2021-07-09
"보건의료원 장례식장(지하1층)",공공용,전라북도 무주군 무주읍 한풍루로 413,전라북도 무주군 무주읍 당산리 701,36.005882,127.6716991,1201,1456,Y,장례식장,063-320-8212,전라북도 무주군 보건의료원,2021-07-09
"부영아파트 지하주차장(지하1층)",공공용,전라북도 무주군 무주읍 신교로 49,전라북도 무주군 무주읍 읍내리 1427-1,36.01032536,127.6667897,1648,1998,Y,지하주차장,063-324-3014,부영아파트 관리사무소,2021-07-09
"휴먼시아파트 지하주차장(지하1층)",공공용,전라북도 무주군 무주읍 장터로 26,전라북도 무주군 무주읍 읍내리 1190-1,36.006937223,127.653614164,1306,1583,Y,지하주차장,063-324-0041,남대천휴먼시아파트 관리사무소,2021-07-09
"무풍면 주민자치센터(지하1층)",공공용,전라북도 무주군 무풍면 현내로 171,전라북도 무주군 무풍면 현내리 574,35.969941,127.8445648,640,776,Y,주민자치센터,063-320-5757,전라북도 무주군 무풍면 주민자치센터,2021-07-09
"설천면 주민자치센터(지하1층)",공공용,전라북도 무주군 설천면 무설로 1607,전라북도 무주군 설천면 소천리 903,36.008166504,127.789690295,778,943,Y,주민자치센터,063-320-5811,전라북도 무주군 설천면 주민자치센터,2021-07-09
"안성면 주민자치센터(지하1층)",공공용,전라북도 무주군 안성면 안성로 246-17,전라북도 무주군 안성면 장기리 1556,35.8634833,127.6530465,66,80,Y,주민자치센터,063-320-5911,전라북도 무주군 안성면 주민자치센터,2021-07-09
"무주에코르아파트 지하주차장(지하1층)",공공용,전라북도 무주군 설천면 하평지1길 10,전라북도 무주군 설천면 소천리 1553,36.011354242,127.786646777,1464,1775,Y,지하주차장,063-322-0360,무주에코르아파트 관리사무소,2021-07-09
